[
  {
    "id": "framework-vs-librairie",
    "title": "Framework vs Library",
    "category": "Frameworks & Ecosystem",
    "badge": { "id": "badge-framework-lib", "name": "Master of Foundations", "emoji": "🧱" },
    "griotIntro": [
      "At the great fair of Louga, you choose for yourself which merchant to approach — you decide the path.",
      "A library works the same way: you're the one who calls it. A framework, on the other hand, imposes its own path and calls you when IT decides to."
    ],
    "explanation": {
      "text": "The real distinction isn't the size of the code, but who controls the flow of execution — this is called inversion of control. Click on the lines to see the difference.",
      "code": "// Library: YOU call the code, you keep control\nimport { formatDate } from 'date-fns';\nconsole.log(formatDate(new Date(), 'dd/MM/yyyy'));\n\n// Framework: IT calls your code (inversion of control)\n// React decides WHEN to call your component\nfunction MyComponent() {\n  return <h1>Hello</h1>;\n}\n// -> React controls the lifecycle, not you\n\n// Even a custom hook remains subject to React's rules\nfunction useCounter() {\n  return useState(0);\n}",
      "annotations": [
        { "line": 2, "note": "You decide when to call `formatDate` — your code is driving, the library just waits to be called." },
        { "line": 6, "note": "You write `MyComponent`, but you never call it yourself — React decides when to render it, re-render it, or destroy it." },
        { "line": 9, "note": "This is inversion of control: with a framework, IT holds the thread of execution, your code slots into ITS structure." },
        { "line": 13, "note": "Even a custom hook (`useXxx`) remains a function that React must call itself according to its own rules — reusable logic never fully escapes inversion of control." }
      ]
    },
    "bugHunt": {
      "lines": [
        "function Counter() {",
        "  const [n, setN] = useState(0);",
        "  return n;",
        "}",
        "",
        "// We want to reuse the logic without going through React",
        "const value = Counter(); // direct call of the component function",
        "console.log(value);"
      ],
      "buggyLineIndex": 6,
      "explanation": "Counter is a React component, not an ordinary function: calling it directly breaks the rules of hooks, because `useState` must be invoked by React itself, within the context of a render managed by the framework. This is inversion of control in action — React must call `Counter()`, never your own code. To reuse this logic outside of a component, you need to extract a custom hook (e.g. `useCounter`) and call it from a real component."
    },
    "useCases": [
      "Choosing lodash or date-fns (libraries) for one-off utilities, without imposing structure on the rest of the project.",
      "Choosing React, Angular, or NestJS (frameworks) to structure an entire application according to imposed conventions.",
      "Express sits between the two: it structures HTTP routes but remains much more permissive than a framework like NestJS."
    ],
    "relatedTools": [
      { "name": "date-fns / lodash", "description": "Classic utility libraries: you import only the functions you need, with no structural constraints." },
      { "name": "React / Angular / NestJS", "description": "Frameworks that impose their own lifecycle and conventions — code is written \"inside\" their structure." },
      { "name": "Express", "description": "Often called a \"micro-framework\": it structures HTTP routing but leaves everything else completely free, unlike NestJS." }
    ],
    "practice": {
      "question": "Why is Express said to be closer to a library than NestJS?",
      "options": [
        "Express lets developers organize their project however they want, while NestJS imposes a precise structure (modules, decorators)",
        "Express is newer than NestJS",
        "Express cannot handle HTTP routes"
      ],
      "correctIndex": 0,
      "feedback": {
        "correct": "Exactly — the library/framework spectrum isn't binary, Express sits between the two.",
        "incorrect": "The key difference is the degree of structural constraint imposed, not age or routing features."
      }
    },
    "quiz": [
      {
        "question": "What is the fundamental difference between a library and a framework?",
        "options": [
          "Who controls the flow of execution: you (library) or it (framework, inversion of control)",
          "A library is always smaller in code size",
          "A framework can never be used partially"
        ],
        "correctIndex": 0,
        "difficulty": "facile"
      },
      {
        "question": "What is \"inversion of control\"?",
        "options": [
          "The framework calls your code according to ITS own rules, rather than your code calling the framework",
          "A principle that only exists in object-oriented programming",
          "Reversing the order of unit tests"
        ],
        "correctIndex": 0,
        "difficulty": "facile"
      },
      {
        "question": "Can a library easily be replaced in a project?",
        "options": [
          "Generally yes, because it doesn't impose a global structure on the rest of the code",
          "Never, a library is just as constraining as a framework",
          "Only if the project has a single file"
        ],
        "correctIndex": 0,
        "difficulty": "moyen"
      },
      {
        "question": "Why is switching frameworks mid-project generally more costly than switching libraries?",
        "options": [
          "Because the code is written \"inside\" the framework's conventions, not just connected to it",
          "Because frameworks are always paid",
          "It's never more costly, that's a myth"
        ],
        "correctIndex": 0,
        "difficulty": "moyen"
      },
      {
        "question": "In an interview, how would you justify choosing a library over a framework for a small utility script?",
        "options": [
          "A framework would add structure and a learning curve disproportionate to a one-off, isolated need",
          "Frameworks are always forbidden for small scripts",
          "Libraries are always faster at runtime, without exception"
        ],
        "correctIndex": 0,
        "difficulty": "difficile"
      },
      {
        "question": "A developer claims a library can never become large or complex, unlike a framework. What do you think?",
        "options": [
          "That's false: the size and complexity of the code don't define the library/framework distinction, only control of the execution flow matters",
          "That's true, a library always stays small by definition",
          "That's true only for libraries written in JavaScript"
        ],
        "correctIndex": 0,
        "difficulty": "moyen"
      },
      {
        "question": "Why is code written with a simple library often easier to test than a component tightly coupled to a framework's lifecycle?",
        "options": [
          "Because you call the library's functions yourself in isolation, whereas a component driven by the framework often depends on a runtime environment that needs to be simulated",
          "Because frameworks technically cannot be tested at all",
          "Because libraries never have bugs, unlike frameworks"
        ],
        "correctIndex": 0,
        "difficulty": "difficile"
      }
    ],
    "culture": "The debate \"is React a framework or a library\" comes up regularly in the JS community: React officially presents itself as a \"library\" (for the UI only), but its ecosystem (React Router, hooks, component lifecycle) makes it work like a framework in practice — the line is sometimes more a matter of marketing than strict definition.",
    "pionnier": {
      "nom": "Martin Fowler",
      "portrait": "British software engineer and author, long-time Chief Scientist at ThoughtWorks, known for having formalized many software architecture concepts widely adopted by the industry.",
      "contribution": "In an influential 2004 article (\"Inversion of Control Containers and the Dependency Injection pattern\"), he clarified and popularized the term \"inversion of control,\" which has since become the reference criterion for distinguishing a framework from a library.",
      "problematique": "Developers used the terms \"framework\" and \"library\" confusingly, with no clear criterion to distinguish them beyond code size or complexity.",
      "solution": "He proposed defining the distinction by who holds control of the execution flow: the calling code (library) or the called code (framework, via inversion of control).",
      "resultat": "This criterion is now taught and cited in nearly all resources and technical interviews dealing with this topic, far beyond his original article."
    },
    "ambiguite": {
      "question": "Is React a framework or a library?",
      "reponse": "Officially a library (it only handles display), but in practice it largely imposes its own way of structuring an application (components, state, lifecycle) to the point where many developers consider it a framework. It's a good example that this boundary isn't always clear-cut."
    }
  },
  {
    "id": "react-vue-angular",
    "title": "React, Vue, Angular: Compared Cultures",
    "category": "Frameworks & Ecosystem",
    "badge": { "id": "badge-frontend-frameworks", "name": "Master of Interfaces", "emoji": "🖼️" },
    "griotIntro": [
      "Three different caravans can all take you to Louga — each with its own pace and its own rules of travel.",
      "React, Vue, and Angular solve the same problem (building interfaces) with very different philosophies."
    ],
    "explanation": {